{
  "$schema": "https://github.com/MesmerPrism/rusty-morphospace-work-environment/schemas/owner-validator-registry.schema.json",
  "schema": "rusty.morphospace.workflow.owner_validator_registry.v1",
  "registry_id": "morphospace-owner-validator-registry",
  "revision": 1,
  "created_at": "2026-07-12T08:15:00.0000000Z",
  "foundation_commit": "a4f89480df302eb62d03866ffb80995924eff855",
  "previous_registry": null,
  "validators": [
    {
      "validator_id": "wf005-workspace-owner",
      "owner_repo_id": "work-environment",
      "owner_revision": "b568aab1e2a382abc44b954a3bcc50917cea535d",
      "owner_tree_oid": "eb2f6f1cd6c13598b583743cb1cd334ab1ee38e5",
      "path": "scripts/Invoke-Wf005OwnerValidator.ps1",
      "sha256": "d638d34d3433ba77b9927890cee029753f838d6d466fc6dc0901c3861417018b",
      "git_blob_oid": "a84836e012a31ecfcf6b7654d9441cdfe6e50eab",
      "entrypoint": "powershell-file",
      "profiles": ["deep"],
      "acceptance_ids": [
        "candidate-maturity",
        "derived-state",
        "device-derivation",
        "inert-defaults",
        "inflight-adoption",
        "native-workspace",
        "overlay-content-integrity",
        "spatial-history",
        "unit-attribution",
        "validator-derived-evidence"
      ],
      "evidence_schema": "rusty.morphospace.workflow.owner_validation.v1",
      "input_closure": [
        {
          "repo_id": "work-environment",
          "kind": "git-tree",
          "paths": ["scripts/", "schemas/", "templates/"]
        },
        {
          "repo_id": "quest",
          "kind": "git-tree",
          "paths": [
            "apps/spatial-camera-panel-android/morphospace/",
            "apps/native-renderer-android/morphospace/",
            "tools/checks/Test-SpatialCameraPanelWorkflowStatic.ps1"
          ]
        },
        {
          "repo_id": "planning",
          "kind": "git-tree",
          "paths": [
            "agent-state/morphospace-autonomous-iteration-roadmap-2026-07-10.json",
            "workspaces/morphospace-platform-iteration/morphospace/"
          ]
        }
      ],
      "timeout_seconds": 600,
      "max_output_bytes": 16777216,
      "mutation_policy": "temp-output-only",
      "device_policy": "forbidden"
    }
  ]
}
